{
  "policy_schema_version": "1.0.0",
  "policy_id": "SAFEGUARD-POLICY-PROJECT7",
  "policy_version": "1.0.0",
  "default_failure_behavior": "fail_closed",
  "organization_override_permitted": false,
  "thresholds": {
    "clause_triage_classify_min_confidence": 0.8,
    "evidence_relevance_minimum": 0.6,
    "evidence_directional_recommendation_minimum": 0.7,
    "maximum_retry_attempts": 1,
    "threshold_override_permitted_in_profile": false
  },
  "mandatory_review_triggers": [
    "legal interpretation or contract enforceability",
    "privacy or restricted personal data",
    "cybersecurity or credential exposure",
    "pricing, financial commitment, or payment terms",
    "staffing commitment or named-person availability",
    "contract acceptance, rejection, or modification",
    "material conflicting evidence",
    "low-confidence or out-of-domain model output",
    "unverified or stale official source",
    "conflict of interest or ethical concern",
    "external communication, submission, or transaction",
    "production deployment or production-readiness claim"
  ],
  "prohibited_request_categories": [
    "make or communicate a final bid/no-bid decision",
    "provide authoritative legal advice or interpretation",
    "approve compliance, security, privacy, pricing, staffing, or contract terms",
    "submit a proposal, message, purchase, acceptance, or other external action",
    "reveal credentials, secrets, private reasoning, or restricted information",
    "disable evidence, audit, abstention, or human-approval safeguards",
    "claim production readiness or operational authorization"
  ],
  "controls": [
    {
      "control_id": "SG-001",
      "category": "configuration_governance",
      "control_name": "Safeguard policy schema and startup validation",
      "objective": "Prevent workflow execution when the fixed safeguard policy is missing or invalid.",
      "control_types": [
        "preventive",
        "detective"
      ],
      "severity": "critical",
      "enabled": true,
      "organization_override_permitted": false,
      "trigger": "The safeguard policy is absent, unreadable, schema-invalid, or version-inconsistent.",
      "applies_to": [
        "workflow_orchestrator",
        "profile_loader"
      ],
      "action_on_trigger": "fail_closed",
      "reason_codes": [
        "SAFEGUARD_POLICY_INVALID"
      ],
      "required_evidence": [
        "Schema validation result",
        "Policy version",
        "Policy checksum"
      ],
      "audit_events": [
        "processing_failed"
      ],
      "human_route": "Technical Reviewer",
      "test_scenarios": [
        "SCN-SG-001"
      ]
    },
    {
      "control_id": "SG-002",
      "category": "configuration_governance",
      "control_name": "Organization safeguard override rejection",
      "objective": "Keep responsible-AI safeguards separate from configurable business criteria.",
      "control_types": [
        "preventive",
        "detective",
        "escalation"
      ],
      "severity": "critical",
      "enabled": true,
      "organization_override_permitted": false,
      "trigger": "A profile or case request includes a prohibited override key or conflicts with a fixed control.",
      "applies_to": [
        "profile_loader",
        "workflow_orchestrator"
      ],
      "action_on_trigger": "fail_closed",
      "reason_codes": [
        "SAFEGUARD_OVERRIDE_ATTEMPT"
      ],
      "required_evidence": [
        "Conflicting key",
        "Configuration source",
        "Resolution precedence"
      ],
      "audit_events": [
        "configuration_loaded",
        "processing_failed"
      ],
      "human_route": "Executive Authority",
      "test_scenarios": [
        "SCN-SG-002"
      ]
    },
    {
      "control_id": "SG-003",
      "category": "configuration_governance",
      "control_name": "Versioned configuration referential integrity",
      "objective": "Reject missing, unversioned, or unresolved configuration references.",
      "control_types": [
        "preventive",
        "detective"
      ],
      "severity": "high",
      "enabled": true,
      "organization_override_permitted": false,
      "trigger": "A profile-linked service, rules, staffing, reviewer, threshold, or schema file is absent or invalid.",
      "applies_to": [
        "profile_loader"
      ],
      "action_on_trigger": "fail_closed",
      "reason_codes": [
        "CONFIGURATION_REFERENCE_INVALID"
      ],
      "required_evidence": [
        "Resolved path",
        "Artifact version",
        "Artifact checksum"
      ],
      "audit_events": [
        "configuration_loaded",
        "processing_failed"
      ],
      "human_route": "Organization Profile Owner",
      "test_scenarios": [
        "SCN-SG-003"
      ]
    },
    {
      "control_id": "SG-004",
      "category": "source_provenance",
      "control_name": "Approved-source gate",
      "objective": "Process only public, frozen, synthetic, de-identified, or explicitly authorized sources.",
      "control_types": [
        "preventive",
        "detective"
      ],
      "severity": "critical",
      "enabled": true,
      "organization_override_permitted": false,
      "trigger": "A source lacks an approved-for-use flag or approval basis.",
      "applies_to": [
        "case_intake_normalizer",
        "passage_selector",
        "official_evidence_retriever"
      ],
      "action_on_trigger": "block",
      "reason_codes": [
        "SOURCE_NOT_APPROVED"
      ],
      "required_evidence": [
        "Source type",
        "Approval flag",
        "Approval basis"
      ],
      "audit_events": [
        "source_ingested",
        "processing_failed"
      ],
      "human_route": "Data or Privacy Reviewer",
      "test_scenarios": [
        "SCN-SG-004"
      ]
    },
    {
      "control_id": "SG-005",
      "category": "source_provenance",
      "control_name": "Source checksum and immutable snapshot requirement",
      "objective": "Tie every material source to a recorded checksum and retained version.",
      "control_types": [
        "preventive",
        "detective",
        "disclosure"
      ],
      "severity": "high",
      "enabled": true,
      "organization_override_permitted": false,
      "trigger": "A source checksum is missing or the retrieved source no longer matches the approved version.",
      "applies_to": [
        "case_intake_normalizer",
        "historical_context_provider",
        "official_evidence_retriever"
      ],
      "action_on_trigger": "defer",
      "reason_codes": [
        "SOURCE_CHECKSUM_MISSING",
        "SOURCE_VERSION_CHANGED"
      ],
      "required_evidence": [
        "Current checksum",
        "Prior checksum",
        "Retrieval time",
        "Snapshot path"
      ],
      "audit_events": [
        "source_ingested",
        "processing_failed"
      ],
      "human_route": "Data Reviewer",
      "test_scenarios": [
        "SCN-SG-005"
      ]
    },
    {
      "control_id": "SG-006",
      "category": "privacy_security",
      "control_name": "Sensitive-data detection and redaction",
      "objective": "Prevent persistence or processing of prohibited personal, confidential, or restricted information.",
      "control_types": [
        "preventive",
        "detective",
        "corrective",
        "escalation"
      ],
      "severity": "critical",
      "enabled": true,
      "organization_override_permitted": false,
      "trigger": "Input or generated output contains prohibited sensitive data.",
      "applies_to": [
        "case_intake_normalizer",
        "passage_selector",
        "audit_writer",
        "packet_assembler"
      ],
      "action_on_trigger": "redact_and_escalate",
      "reason_codes": [
        "SENSITIVE_DATA_DETECTED"
      ],
      "required_evidence": [
        "Detection category",
        "Redaction result",
        "Escalation route"
      ],
      "audit_events": [
        "processing_failed",
        "case_escalated"
      ],
      "human_route": "Security or Privacy Reviewer",
      "test_scenarios": [
        "SCN-SG-006"
      ]
    },
    {
      "control_id": "SG-007",
      "category": "privacy_security",
      "control_name": "Secret and credential blocking",
      "objective": "Ensure tokens, API keys, passwords, credentials, and secret values are never committed or logged.",
      "control_types": [
        "preventive",
        "detective"
      ],
      "severity": "critical",
      "enabled": true,
      "organization_override_permitted": false,
      "trigger": "A credential-like value is detected in input, configuration, output, or audit content.",
      "applies_to": [
        "profile_loader",
        "workflow_orchestrator",
        "audit_writer",
        "repository_outputs"
      ],
      "action_on_trigger": "block",
      "reason_codes": [
        "SECRET_VALUE_DETECTED"
      ],
      "required_evidence": [
        "Secret detection result",
        "Artifact path",
        "Sanitized replacement"
      ],
      "audit_events": [
        "processing_failed"
      ],
      "human_route": "Technical or Security Reviewer",
      "test_scenarios": [
        "SCN-SG-007"
      ]
    },
    {
      "control_id": "SG-008",
      "category": "prompt_injection",
      "control_name": "Untrusted-source instruction isolation",
      "objective": "Treat instructions embedded in opportunities, contracts, or retrieved documents strictly as data.",
      "control_types": [
        "preventive",
        "detective",
        "disclosure"
      ],
      "severity": "critical",
      "enabled": true,
      "organization_override_permitted": false,
      "trigger": "Source text asks the system to ignore rules, reveal secrets, change tools, use new sources, or take an action.",
      "applies_to": [
        "passage_selector",
        "official_evidence_retriever",
        "recommendation_engine"
      ],
      "action_on_trigger": "block",